S/N,Name of Organisation,Type,UEN,IPC Period,Sector,Classification,Activities
361,SUPPORT FOR THE ARTS FUND,Exempt Charity with IPC,T08CC3019F,From 01/8/2020 to 31/7/2023,Arts and Heritage,"Literary Arts,Music & Orchestras,Professional, Contemporary & Ethnic Dance,Theatre & Dramatic Arts,Traditional Ethnic Performing Arts,Training & Education,Visual Arts","Public awareness, promotion & advisory"
362,SWEE KOW KUAN TEMPLE,Registered,S80SS0186B,Not Applicable,Religious,Taoism,Direct Services
363,Sze Hock Keng Tua Peh Kong Association,Registered,S92SS0022K,Not Applicable,Religious,Taoism,
364,Tabernacle Bible Presbyterian Church,Registered,T05SS0089D,Not Applicable,Religious,Christianity,
365,TABERNACLE OF HOLINESS CHURCH LIMITED,Registered,198001178E,Not Applicable,Religious,Christianity,
366,Tai Pei Buddhist Centre,Registered,T01SS0214F,Not Applicable,Religious,Buddhism,Training & education
367,TAI SENG CHRISTIAN CHURCH (C.N.E.C.) LIMITED,Registered,198404204K,Not Applicable,Religious,Christianity,Supports other Charities
368,TAI YEONG KON TEMPLE,Registered,S87SS0127C,Not Applicable,Religious,Buddhism,
369,TALENTTRUST LIMITED,Registered with IPC,201430501R,From 09/10/2021 to 08/10/2023,Others,General Charitable Purposes,"Direct Services Public awareness, promotion & advisory Supports other Charities Training & education"
370,TAMIL METHODIST CHURCH - SHORT STREET,Registered,S87CC0512J,Not Applicable,Religious,Christianity,"Financial assistance, bursaries & scholarships"
371,TAMPINES WEST CCC COMMUNITY DEVELOPMENT AND WELFARE FUND,Registered with IPC,S92CC0903H,From 01/7/2021 to 30/6/2024,Community,North East,"Public awareness, promotion & advisory Financial assistance, bursaries & scholarships Supports other Charities Training & education"
372,T'ANG QUARTET LIMITED,Registered,200102183D,Not Applicable,Arts and Heritage,Music & Orchestras,Training & education
373,TANG RENAISSANCE,Registered with IPC,201630110G,From 27/2/2023 to 26/2/2025,Arts and Heritage,Traditional Ethnic Performing Arts,"Training & education Public awareness, promotion & advisory"
374,TANGLIN TRUST SCHOOL FOUNDATION LIMITED,Registered,201212078W,Not Applicable,Education,Foundations & Trusts,Grantmaking Training & education
375,Taoist Federation (Singapore),Registered,S90SS0063E,Not Applicable,Religious,Taoism,"Public awareness, promotion & advisory Supports other Charities"
376,TAY LECK TECK FOUNDATION,Registered,197600306D,Not Applicable,Social and Welfare,Community,
377,TEATER EKAMATRA LTD.,Registered,201130737W,Not Applicable,Arts and Heritage,Theatre & Dramatic Arts,
378,TEEN CHALLENGE ENTERPRISES LTD.,Registered,200306056R,Not Applicable,Social and Welfare,"Children/Youth,Community",Direct Services
379,TEMENGGONG ARTISTS-IN-RESIDENCE LTD.,Registered with IPC,200916397C,From 12/8/2021 to 11/8/2023,Arts and Heritage,Visual Arts,"Public awareness, promotion & advisory"
380,Tenrikyo Mission Center in Singapore,Registered,S71SS0034G,Not Applicable,Religious,Others,Direct Services Training & education
381,Teong Siew Kuan Temple Association,Registered,S86SS0012L,Not Applicable,Religious,Taoism,
382,TFA LALITA KALA COMPANY,Registered with IPC,200410925C,From 01/3/2022 to 29/2/2024,Arts and Heritage,Traditional Ethnic Performing Arts,
383,THE A CAPPELLA SOCIETY LTD.,Registered,200721181D,Not Applicable,Arts and Heritage,Music & Orchestras,"Public awareness, promotion & advisory Training & education"
384,The GZ Charitable Trust,Deregistered,T14CC0005E,Not Applicable,Others,General Charitable Purposes,"Grantmaking Financial assistance, bursaries & scholarships Supports other Charities Training & education"
385,THE HAGUE INTERNATIONAL MODEL UNITED NATIONS LIMITED,Registered,200507109D,Not Applicable,Others,General Charitable Purposes,
386,THE ISLAND FOUNDATION LTD.,Registered,201011968M,Not Applicable,Others,General Charitable Purposes,Direct Services Training & education
387,THE LIVING WAY CHURCH LTD.,Registered,200300692M,Not Applicable,Religious,Christianity,
388,The Masonic Charitable Fund,Registered,T19CC0001B,Not Applicable,Education,Local Educational Institutions/Funds,"Financial assistance, bursaries & scholarships Training & education"
389,The Mission to Seafarers Singapore,Registered,S83SS0014K,Not Applicable,Social and Welfare,Community,"Direct Services Public awareness, promotion & advisory"
390,THE PRIVATE MUSEUM LTD.,Registered with IPC,201005410R,From 03/5/2022 to 02/5/2024,Arts and Heritage,"Historical & Cultural Conservation,Visual Arts","Public awareness, promotion & advisory"
391,THE SELECT CENTRE LTD.,Registered,201527668D,Not Applicable,Arts and Heritage,"Literary Arts,Training & Education","Public awareness, promotion & advisory"
392,THE SOPHIA FOUNDATION LIMITED,Registered,201328650M,Not Applicable,Others,General Charitable Purposes,
393,THE SPIRITUAL ASSEMBLY OF THE BAHA'IS OF SINGAPORE LTD.,Registered,197602001W,Not Applicable,Religious,Others,Training & education
394,THE TITULAR SUPERIOR OF THE BROTHERS OF ST. GABRIEL IN SINGAPORE,Exempt Charity,T08CC4001B,Not Applicable,Religious,"Christianity,Environment",
395,THE WAN BOO SOW CHARITY FUND LIMITED,Registered with IPC,200509963D,From 11/6/2021 to 10/12/2023,Social and Welfare,Community,"Financial assistance, bursaries & scholarships Supports other Charities Training & education"
396,THE WAY CHURCH LIMITED,Registered,197902947R,Not Applicable,Religious,Christianity,Direct Services Supports other Charities
397,THE WP COMMUNITY FUND,Registered,201401272N,Not Applicable,Social and Welfare,"Children/Youth,Community,Disability (Adult),Disability (Children),Eldercare,Family,Support Groups","Direct Services Public awareness, promotion & advisory Financial assistance, bursaries & scholarships"
398,THONG CHAI INSTITUTE OF MEDICAL RESEARCH,Registered with IPC,200311661W,From 18/4/2022 to 17/4/2025,Health,TCM Clinic,Training & education Research
399,Tian Teck Keng Temple,Registered,S91SS0025D,Not Applicable,Religious,Taoism,Direct Services
400,Tien Sen Tua Temple,Registered,S93SS0019D,Not Applicable,Religious,Taoism,"Public awareness, promotion & advisory"
401,Ti-Sarana Buddhist Association,Registered,S77SS0035L,Not Applicable,Religious,Buddhism,
402,TOONG CHAI ENGLISH PRESBYTERIAN CHURCH,Registered,T12SS0059K,Not Applicable,Religious,Christianity,Direct Services
403,TOONG CHAI PRESBYTERIAN CHURCH,Registered,T11SS0127L,Not Applicable,Religious,Christianity,
404,True Jesus Church (Telok Kurau),Registered,S61SS0030J,Not Applicable,Religious,Christianity,Direct Services
405,Tung Ling Community Services,Registered,T03SS0069F,Not Applicable,Social and Welfare,"Community,Eldercare",Direct Services
406,TWEE BOEY TENG NIANG TEMPLE,Registered,T04CC1816K,Not Applicable,Religious,Taoism,
407,ULU PANDAN CCC COMMUNITY DEVELOPMENT AND WELFARE FUND,Registered with IPC,S86CC0308D,From 01/4/2021 to 31/3/2024,Community,North West,"Financial assistance, bursaries & scholarships"
408,United Indian Muslim Association,Registered,S64SS0034H,Not Applicable,Religious,Others,"Financial assistance, bursaries & scholarships Supports other Charities Training & education"
409,Voices For Animals,Registered,T14SS0132G,Not Applicable,Others,Animal Welfare,"Direct Services Public awareness, promotion & advisory Supports other Charities Training & education"
410,Wah Sua Keng Temple,Registered,S88SS0043K,Not Applicable,Religious,Taoism,"Financial assistance, bursaries & scholarships Supports other Charities"
411,WAN MIN COMMUNITY SERVICES,Registered,T02SS0215G,Not Applicable,Social and Welfare,Community,"Public awareness, promotion & advisory Supports other Charities Training & education"
412,Welcare Student Care Centre,Registered,T02SS0141C,Not Applicable,Social and Welfare,Children/Youth,Training & education
413,WEST COAST CCC COMMUNITY DEVELOPMENT AND WELFARE FUND,Registered with IPC,S99CC1352G,From 01/4/2023 to 31/3/2026,Community,South West,"Financial assistance, bursaries & scholarships Supports other Charities"
414,WEST COAST HOCK TECK SI,Registered,S76SS0054J,Not Applicable,Religious,Buddhism,
415,Wind Bands Association of Singapore,Registered,T01SS0092F,Not Applicable,Arts and Heritage,Music & Orchestras,Training & education
416,Wing Tai Foundation,Registered,T10CC0007K,Not Applicable,Social and Welfare,Community,
417,WOODBRIDGE HOSPITAL CHARITY FUND,Deregistered,T01CC1489K,From 28/2/2021 to 27/2/2024,Health,,"Public awareness, promotion & advisory Financial assistance, bursaries & scholarships Training & education Research"
418,WOODLANDS CCC COMMUNITY DEVELOPMENT AND WELFARE FUND,Registered,T07CC2011J,Not Applicable,Community,North West,"Financial assistance, bursaries & scholarships"
419,WORD Community Church,Registered,T04SS0158A,Not Applicable,Religious,Christianity,Direct Services Training & education
420,WORLD FUTURE FOUNDATION LTD.,Registered,200816862W,Not Applicable,Others,Environment,
421,WRESTLING FEDERATION OF SINGAPORE,Registered with IPC,T08SS0214H,From 01/2/2022 to 31/1/2025,Sports,NSAs,"Public awareness, promotion & advisory Financial assistance, bursaries & scholarships Training & education"
422,WYCLIFFE BIBLE TRANSLATORS (SINGAPORE) LTD,Registered,198306044C,Not Applicable,Religious,Christianity,"Public awareness, promotion & advisory Training & education"
423,Yan Kit Village Chinese Temple,Registered,S95SS0028A,Not Applicable,Religious,Taoism,Supports other Charities
424,Yi Do An Chinese Temple,Registered,S94SS0150A,Not Applicable,Religious,Taoism,
425,YIO CHU KANG CCC COMMUNITY DEVELOPMENT AND WELFARE FUND,Registered with IPC,S87CC0460G,From 01/4/2021 to 31/3/2024,Community,Central,"Financial assistance, bursaries & scholarships"
426,Yishun Christian Church (Council),Exempt Charity,T08CC4084H,Not Applicable,Religious,Christianity,
427,Yokoshi Tomo No Kai (Singapore),Registered,S84SS0051C,Not Applicable,Religious,Others,Direct Services
428,Young Life,Registered,T03SS0025B,Not Applicable,Religious,Christianity,Direct Services
429,YOUNG PEOPLE'S PERFORMING ARTS ENSEMBLE LTD,Registered with IPC,199900287D,From 25/5/2022 to 24/11/2023,Arts and Heritage,Theatre & Dramatic Arts,
430,Yu Feng Zhi Fu Cai Bo Xing Jun Miao,Registered,T04SS0018A,Not Applicable,Religious,Taoism,Supports other Charities
431,Yuan Meng Shih Temple,Registered,S97SS0138G,Not Applicable,Religious,Buddhism,"Public awareness, promotion & advisory"
432,Zion Living Streams Community Church,Registered,S98SS0054C,Not Applicable,Religious,Christianity,Direct Services
433,Zonta Singapore- Project Pari Fund,Registered with IPC,T10CC0004L,From 01/5/2021 to 31/1/2024,Social and Welfare,Community,"Financial assistance, bursaries & scholarships"